question_id,member_id,question,type
60131,92644,you wouldn't have been able to buy a cup of coffee.為何不是用you wouldn't be able to buy a cup of coffee,13
59153,92644,"get working smarter and faster,為何get後不是work而是working",12
46592,92644,there were times when it seemed like這個句型不太知道如何拆解使用,5
45748,92644,"that happen to you這句說得很快,一直無法有效聽出,不知有什麼訣竅嗎",14
43982,92644,"he very first year,very的用意為何？",9
42922,92644,as they had expected可否改為as they expected,1
55259,52246,你好，請問有哪些時候該用which,5
5216,61742,這句聽起來像是you are the names。 聽起來沒有what的音，為什麼呢? ,14
37735,64192,"在課程說明當中....., imagine the impact「 that can have on the issue.」  impact後面省略了一個 that，所以如果沒省略，原句應該是 ....., imagine the impact that  that can have on the issue. 一個句子可以出現2個相連接that，這樣文法是可以的嗎? 第一個that 是帶出子句? 第二個that 是當作主詞嗎?",5
17499,73710,請問I think about how much fun it is to have these special stories to share.這句話的句義分析為何?我無法與中文翻譯聯貫一起，謝謝,14
16662,73710,請問這裡的throughout的中文，是介係詞的遍布還是副詞的各地？,9
15762,73710,請問這裡的skiing是動詞還是名詞?若是動詞為何要加ing?,12
1182,51277,"請問left有留下的意思嗎 因為我用yahoo字典,大概只有左邊的意思",3
1175,51277,我想請問在這其中的holding和marking是名詞嗎 ,5
556,51277,"我所愛的""事""是一位老朋友~ 這裡的what是翻譯成""事"" 感覺有點奇怪",14
46073,33551,The next component to understanding 請問to後面加understanding，是因為to在這裡是介係詞嗎?,9
46055,33551,"He is the one she's been looking for her whole life. 請問上面這句話her whole life前為什麼不用加""in"" her whole life.?",9
12078,33551,"Why is she suddenly gone?  敘述句是She is gone. 請問為什麼用is gone, 是被動的意思嗎?  為什麼過世是被動?",8
58297,83252,"請問這裡為什麼一開始要使用現在式呢，而後面又使用過去式。 The story probably ""begins"" around 10,000 B.C. 如果這都是事實的話是否可以都使用現在式呢? ",3
55205,83252,"老師您好， 這段文字有些結構我不是很清楚想向您請教一下 1. I've seen my father's role as a parent ""being valued less"" by society 看起來是大致的結構是: I've seen + O + adj子句。其中my father's role as a parent 整個當作受詞，不過我不確定文法上有沒有的專有名詞。然後being valued less by society  應該是一個形容詞子句，前面省略了who is。用being是想解釋狀態持續存在。  2. my needing his presence as a child as much as my mother's 這句話的needing接在所有格後面感覺應該是名詞，但這樣想我就有兩個問題 a) 這個子句動詞是誰阿 b) needing 和 need 差在哪裡  謝謝你囉!  ",9
53991,83252,Confuse about/at/with/by 請問有什麼區別呢，為什麼這裡要用confuse at 呢,8
53821,83252,"可以稍微分析一下 It is that this has to stop 這句話的結構嗎？ 另外這件事情感覺是要""被阻止""，不需要使用被動嗎？ 像是 it is that this has to be stopped之類的",8
26060,83252,這句話的結構有點不懂？主詞好像省略去了。 後面not loving也很少這樣用。 他是怎麼寫出這樣的句子阿？,12
25826,83252,"這裡, all of which只的就是前面那些our first kiss, lite-night sneaking and matinee movies.  若這裡只打, which 意思上是否會有差別 另外有或沒有"",""是不是也會有差別 我有點忘記which 加逗號與不加逗號再句意上的不同了。",10
25717,83252,"為什麼是用gradaut""ing""，graduated",12
25515,83252,This is something we eventually have to face and accept 這句話的時態是否需要使用過去式？還是他是在陳述事實？,3
22188,68524,請問lying around，為什麼lying要用ing型態?,12
21486,68524,請問為什麼you're left，are的後面是接left而不是V+ing呢?,8
10217,68524,"Especially in business,  you've got to be able to learn how to articulate your message. 請問這句how to articulate那句，是不是影片有說到word這個字，是我聽錯還是字幕錯誤?",14
5206,56431,I'm afraid to ask 為什麼這翻成：我恐怕要問而不是我害怕地問？,14
4389,56431,Antarctica這個字我一直發不好，跟原因念的不太一樣，中間tar的音好像被帶過了，請問有什麼建議關於這個字的發音嗎？,14
56265,99614,"because it isn't your accent that's the problem.(因為並不是你的腔調是那個問題) 不懂翻譯的""是那個問題""是什麼意思?",14
91212,100573,請問through和perforation都是穿過的意思，為何要用2個穿過,9
48725,27554,"And the first one  kind of  blows people out of the water. 請問 kind of  blows 中間的of 要如何發音, 我聽不太出來 謝謝",14
45558,92939,這句有甚麼特別的文法，例如has since或是其他的，可以解釋一下嗎?,1
43767,92939, Alta gets a significant amount of snow這句裡的significant要怎麼翻譯?,14
43759,92939,為甚麼[where you have a pass]這句的翻譯是[你有入場券的地方]?,14
25101,82241,"這裡老師好像念成:  So ""in""  on any given day....",9
117306,58634,"The golden rule here is ""do not do this ..... 第一個do 老師跟影片都是發 to 的音??  為什麼要這樣發音",14
98993,58634,It's only in the last few hundred years that civilization has  gotten in the way. 為什麼這一句的翻譯這麼奇怪,14
25224,58634,"it's really important to  make sure that you're not using the  ill-fated one-word response.   使用""ill-fated""這一個字眼中文翻譯起來覺得怪怪的。外國人這樣的用法有什麼用意呢 ",14
36833,26632,"let's say you get five responses 這句話聽起來似乎比較像let's ""see"" you get... 請問這樣是否也說的通呢？ 謝謝～",14
32933,89862,這裡的by the way要怎麼翻？,14
7570,62065,I didn't know what  went on  為什麼用went不用go,3
7202,62065,onion stuck with a  clove  這裡stuck是指被插入嗎,13
6732,62065,"I found Tim boring, but Windy found him attractive.  I just find the shears easier.  我想知道這兩句裡面find跟found的用法差異",3
5909,62065,dancer 這發音原音跟老師發音不一樣 有滿多類似這樣的問題 我不知道該學哪個 老師發音跟我以前學校學的是一樣 但是原音是外國人發音 麻煩幫忙解答，謝謝^^,14
34873,83978,"you're going to steal that coin from that bottom card as you then show the bottom card to the audience by bringing it up, 請講解這句文法的as you then...",10
28662,83978,為什麼要用 be getting to呢？ ,2
46606,53896,Vivienne is in her pajamas，為何不是Vivienne was in her pajamas,3
42368,53896,be about to 與 be going to 有差別嗎? ,4
41727,53896,這裡不用did的理由是? ,3
41462,53896,"as you speak 是否應該翻譯成 當你""們""說話，不然會使人理解要邊說話邊點頭。",14
40698,53896,不太清楚這裡 is 的用法 <br >Wherever you're meeting the pers question ?,7
36167,53896,I love working with children. 我本來翻譯成我喜歡與小孩一起工作。 若改成I love working on children. 語意有甚麼差別?  ,14
36092,53896,1.  I want this so bad 翻譯成：我如此想要這件事? 2.  It's not necessarily the brains (it's the brains that got you there) 若改成關係子句： It's not necessarily the brains which/that got you there. 語意有差嗎? 3. 一邊寫作可以用括弧來補述嗎? ,14
33538,53896,可以 比較 want answered  和 want to answer 和 want to get an answer 的用法嗎?,13
32161,53896,and yet  的用法? 詞性? adv嗎?,10
18932,53896,"請問 650 million，原文發音是600 ""and"" 50 million，有and 嗎?  沒有and 應該也沒關係吧? ",14
17566,53896,這裡為何用who當作非人稱的關係代名詞?,5
13429,53896,You are left.  left 是過去分詞? 翻譯成你被留下來??,14
13428,53896,You can either break the backbone off. 為何要翻譯成：你可以不要折斷背骨... ， 為何要加否定句?,14
11766,53896,"""the person interviewing you"" 是名詞子句的簡化具嗎?  That the person interviews you ",7
11542,53896,聽起來像是life,14
55204,97267,這邊的that是甚麼意思，甚麼樣的文法會這樣用呢,10
54393,97267,這邊的that是關系子句的意思嗎?那that代表哪一個字,10
50139,97267,"the single和best predictor 都是在形容""question""嗎?如果是的話，為什麼這兩者可以直接連在一起講，不需要甚麼介係詞嗎?",9
48537,97267,"這邊""that""所代表句子是甚麼?而""it""代表的句子是甚麼?",10
43996,95101,"我在學習成果中看到有一段查過字典的紀錄，上面寫著""共查過 9 個單字 / 共學會 0 個單字(聽寫正確)""，請問""學會0個單字""這個部份，我應該會有什麼樣的測試才算學會單字呢? 另外，在體驗時有訓練英文key in(寫)，但暖身課程中沒有這個部份嗎? 再請回覆，謝謝",14
77750,78195,請問這裡的trussing是名詞還動詞呢？ 查詢時名詞是truss有花束、乾草捆， 但truss動詞卻是綑綁的意思？ 查詢的跟翻譯的對不起來？,14
74989,78195,"When Godtfred returned, Ole explained that that wasn't the way to create a good brand. 你好請問一下這句話裡面有兩個that聽朗讀很像the that可是又覺得不應該是，麻煩我解答，謝謝",14
74839,78195,你好，解釋上只有說以下兩個的意思不相同，但我想知道實際上翻譯時差在哪裡，謝謝。 (x) I only coated the ducks twice (o) I coated the ducks only twice ,14
43394,78195,您好請問get through的through在這裡是算形容詞嗎?,9
404,52432,You are always judged by the way you perform-你永遠都會由於你的表現被評論  查了單字後，不大懂這句怎麼會這樣翻譯,14
20981,56705,"請問 I am nearly finished. 照字面翻，像是""我快要被完結了"" 是不是應該使用 finishing比較好??",14
9237,56705,"They transfer it by cart , 聽起來像是 They transferred by cart。transfer應做為不及物動詞，且聽不到it的發音，請協助確認",14
9224,56705,請問powered如何發音?,14
31400,85974,including是介係詞?用法?介係詞前後的詞性接法?,9
31396,85974,That 在這裡是什麼詞性,5
29255,85974,"This is the third successful business that I have started and run.,這裡的that指的是? 一般看到句子會直接翻,這是第三個成功的事業.......但是這裡是我已開創和經營第三個成功的事業!",14
28550,85974,"we began to imitate our mom,began 時態的用法?",3
28538,85974,看到JUST就是要用現在進行式嗎?,2
27479,85974,yet的意思及用法?,10
4072,55282,who magically flew to the moon and lived there at  Jade Palace. 請問這裡為什麼用who而不是she?,5
17640,66130,with a relationship reflective of the city we were in 請問為什麼是用reflective of  不是應該用動詞嗎 ? ,5
46745,95504,nodding your head as you speak to show that you're listening. 在你說話時點點你的頭，以顯示你正在聽。 這句是否有語病(我說話時點頭表示我在聽) 應該是說在對方說話時，我點頭 表示我正在聽,14
56927,100526,if you want to be [presenting] in English 為什麼presenting查的單字跟他給的不太一樣 他是現在.當前的意思嗎?? ,12
20313,73565,which takes us to the second point. ..us 是不用發音?,14
14644,59391,205 two hundred 「and」 five 中間要放 and 嗎 原音好像有，但是老師發音的部分沒有,14
3948,59391,why waste this life not loving? 為什麼要用 loving 而不是 to love??,6
3396,59391,為什麼我聽到的好像是 them about??,14
31983,79244, I don't wipe my whole face off like it's a washcloth. => like it's a washcloth.這句是用like當介系詞引導的句子嗎?,10
31720,79244,I've been Molly from Jobaroo Q1.這句可以改用這樣的英文來表達嗎?  => I am Molly from Jobaroo. Q2  用現在完成式I have been Molly的用意為何?,1
39801,90524,請問有些連音根本聽不出來該怎麼克服?像是本句were to/ instead of saying/  謝謝,14
22011,79963,"AAA As the pan  heats up, we'll add about  an eighth of a teaspoon of water every 10 to 15 seconds.  BBB As the pan  heats up, we'll add about  an eighth teaspoon water every 10 to 15 seconds.  AAA-BBB=of of  Could I cut 2 ""of"" to look straightly?",9
20092,76535,"if you've had to quit your last job兩個have,第一個have是完成式,第二個have是曾經嗎?",1
19675,76535,"""要準備""為何用被動型態""be prepared""",8
118939,58633,想了解have been的時態用法,11
111389,58633,before you've even begun 想了解一下這種時態的用法,1
71407,59431,為什麼是形容詞collective ，而非動詞collect,6
45254,59431,As more and more of the interactions that we are having take place online.....  請問為何用having?    ,2
43311,91473,請問這邊的so能翻譯成什麼？該怎麼用？,14
7860,51624,You could cut this in half. Under what kind of situation we use could and can? ,3
80525,87595,"想請問that, which, who 怎麼使用?",5
62510,87595,為何不是用過去完成式 I had doneit before and I had had .......,1
49228,73405,老師您好: 請問這句的worked 後面為何要多一個for 呢??,9
47969,73405,老師您好: 請問這句的 a man 後面為何要多一個who 呢?,5
47735,73405,老師您好: 請問I've 的ve 的縮寫 ，在念句子時，發音要發出來嗎? 我感覺有些句子沒念出來，有些又有發出ve 的音,14
45551,73405,這句的ever 翻成“ 從來沒有“ ?? 查了字點，似乎沒有這個意思，請老師幫忙解惑這個字的用法,14
43821,73405,老師您好: 請問這句的had 是用過去式嗎?? 為何要用過去式呢? ,3
43588,73405,老師您好: 這裡的creepy，查字點是令人毛骨悚然的；不寒而慄的，但翻譯是“怪怪的“，好像不搭??,14
42828,73405,老師您好: 請問這句的 I want this so bad ，是指如果不做這件事的話會非常後悔是嗎?? 照課程裡的中文翻譯bad 是想要的意思??但感覺很怪~,14
42385,73405,老師您好: 請問這句的wanting 為何不是用want ?,9
40064,73405,老師您好: 請問這句的needing 加ing是為了變成名詞嗎? need 加ing 是否是特殊的用法?一般很少看到,2
37978,73405,老師您好: 請問decision 後面一般是接on +子句嗎?,9
36962,73405,"老師您好: 請問這句的 he has spotted, 為何是翻成“ 被發現 “，spotted 我查字點是 沾上斑點的意思",14
36508,73405,老師您好: 請問這句的 that is 為何都可以省略呢?一般不是只省略that 而已嗎?,5
35397,73405,老師您好: 請問這句的could 算是過去式用的嗎? 還是用can 也可以?,3
34808,73405,"老師您好: 請問這句的of being hurt, and of being held，的 be 為何要加 ing ? 可以用be hurt 就好嗎? ",9
31801,73405,老師您好: 請問例句中的these days ，為什麼是翻成“今天“的意思，今天除了today外，難道還有其它的詞???,14
30776,73405,老師您好: 請問這句的 just 好像是連接詞，連接前後兩句，just 應該不是個連接詞，我感覺應該可以用and 來連接比較好??,10
30695,73405,老師您好: 不好意思，想再請教一個，have been 一般是有動作持續的意思嗎? have 是代表動作完成，been 是代表動作一直持續下去的意思，這樣的理解對嗎??,1
30693,73405,"老師您好: 這句後面的They were both anxious…，為何動詞是用過去式的 were, 期待想見，應該是還沒見到，過去式代表是已經發生的事，這樣的理解對嗎??",3
30675,73405,"老師您好: 請問There have been a lot of people …與 There are a lot of people  , 在用法或意思上是差別在那邊??",1
29118,73405,老師您好: 請問這句的says 後面是否省略 that ??否則就同時有兩個動詞 says 與sees 了,7
62130,76901,1. as that 有更多例句或用法呢？ 2.請問為何要descend+ing 謝謝,2
17263,76901,The opportunity of buying gold finally came along.  為何用came非come,3
97935,11785,pop that insect  請問pop 如何翻譯,14
97415,11785,most people are faced with .... 不能改成 most people faced with ... 人不是主動面對嗎？為什麼是用被動式？,8
95157,11785,"as is a tale , so is life ==人生像故事一樣.... 這句話 為什麼會要這麼翻譯?? 謝謝！",14
94237,11785,"except that ....這裏翻成 "" 只是"" 而字典卻是 ，除.....之外 ??",14
93950,11785,humbling experience 請問是指 謙遜的經歷？還是令人難堪的經驗？,12
92013,11785,"to inform the outside world "" of ""  what was happening to them ..... 這裏為什麼要用介系詞 of ... 而不是 that ?? ",9
91014,11785,might as well  中的as well 是翻成..也..嗎？  這句翻成，你也可能....??,14
89780,11785,you have never known...  為何我聽起來像 you have never should known....,14
89236,11785,went up to study modern language... 這裏 up 可以省略嗎？ 為什麼要加  went 後面要加 up??,3
89004,11785,both of whom 為什麼不是 both of who came from....,9
79199,11785,請問在被動式中，及物動詞和不及物動詞如何區別？ 及物動詞後面不是要加受詞，而不及物詞不用加受詞， 而這裏 redeem是被動式的及物動詞，為何後面不用加受詞..... 有點錯亂了.....還請為我解惑，謝謝！,8
76775,11785,where 通常不是指一個地方嗎...? 這裏可以用 what  替代嗎？,5
76295,11785,請問 closed 這裏是當形容詞嗎？ 形容詞通常不是在名詞 (both ends of the wrapper)前面修飾嗎？,13
73846,11785,請問這裏可以改成...... attention is given to establish a sales strategy and identify the ..... ---&gt; 因為to 後面不是接原形動詞嗎？,9
73844,11785,rely on  --&gt;點說明的時候，聽不到老師的講解....,14
73484,11785,this will result ........and decreased efficiency； 請問 and 不是連接兩個相同時態的動詞..... 那這裏是不是要改成 decrease?? 謝謝！ ,13
71835,11785,請問這與 we will learn more about..... 意思上有差別嗎？ 謝謝！,2
52260,11785,is related to +  ving  ( 後面是要接 動名詞嗎?) 可以改成 is related to  overcome one's fear.....嗎? ,9
49753,11785,known as referees ，這裏是省略 are 嗎?,5
49505,11785,there have been a lot of people 和 there are a lot of people 有差別嗎？,1
49041,11785,影片中　couture　的發音與老師的發音不太一樣？？ 　,14
49039,11785, this is real moment where ... 請問where 不是形容地方嗎？ 可用while 嗎？ ,5
48779,11785,請has questioned 可改成 questioned,3
47507,11785,"toward 這裏是當介系詞嗎? 為什麼會加後面會加 ""s""",9
45429,11785,請是always  後面可以加過去式嗎？ 是不是要改成 I always want to drive ‧‧‧‧,3
44281,11785,be associated with  --&gt;在這句中為什麼沒有 be 動詞？,5
39239,11785,I've been Molly 與 I am Molly ，請問有不同的意思嗎？,1
36576,11785,"請問you are a customer , 其中 a 發音ㄟ , 但有時發音卻是 ㄛ ，這是為什麼? 另外像 the , 有時聽到的是 ""了""的音，有時卻聽到  [ li ] 的音?? 請問這當中有發音的規則嗎？",14
33698,11785,"請問 and 是連接 time 和 energy ,  那 thinking 呢？ 是不是還需 and , 來連接wasting 和 thinking??",10
33697,11785,it's not  --&gt; 我聽原音是 s 的音，而不是t的音??,14
21933,11785,that 是否省略沒有發音? ,14
21011,11785,spreader 為什麼聽起來是 [ sprader ] 而不是 [sprεder]?,14
21010,11785,"請問 like 前面不是要加 be動詞 才做""像""解釋， wipe & like 同時出現....此時不就有兩個動詞？？",9
19246,11785,請問，all stored in .....，其中stored 是名詞嗎?,13
18123,11785,"get access 是否翻成 取得? 如果是的話，是不是可以省略access, 只用get就好... ",14
13505,11785,"請問老師，為什同樣是mountains , 為什聽起來前面與後面會不同？",14
11647,11785,had to  我似乎沒有聽到to 的音??,14
11009,11785,"eventually [ɪˋvɛntʃʊəlɪ] 我在影片中聽起來像〔əˋvɛntʃʊəlɪ] ,  何者是對的呀？",14
10704,11785,"Give me an example  請問為什麼翻譯成   ""而是問"" ?? 而不是 ""給我一個例子""",14
10606,11785,"asked  影片原音：我聽到的是as ，卻聽不到k 老師朗讀：我聽到的是ast , 亦聽不到k  why ?   ",14
9635,11785,"請問Yet ， 在這邊是否可翻成  ""至今""我收到從小孩來的信...",14
7190,11785,and then the same thing ---&gt;聽不出 有the 的音，我只能聽到 and then same thing on the other side?? 麻煩老師幫我確認一下....謝謝！   ,14
6837,11785,it's more expensive than buying the whole chicken.  ---&gt;其中 buying 為什麼我聽起來向buy ( 無ing)? 謝謝,14
110534,62270,of 跟off的發音有不一樣嗎,14
110321,62270,I'm gonna一直聽成somebody,14
110319,62270,一直聽不到I'm gonna的音,14
110226,62270,your 的發音跟you're 的發音是一樣的嗎,14
110194,62270,none of that matters. 這句話要什麼翻譯,14
109098,62270,projection:為何翻成傳遞聲音,14
108949,62270,to the point where....為何要用where 不用that,5
31711,62270,"請問口語的gonna , wanna 是否有發音，因為每次聽原文，都聽不到有發音",14
3091,58753,kept in touch through the years after.重複聽了好多是，就是聽不到through，在這種組合有特殊輕音或連音念法?,14
2629,58753,You've got to train ----為甚麼不是You've gotten to train,13
2620,58753,我為何完全聽不到她說You Know?,14
80234,72697, hi 我想問一下   So one of the things I wanted to point  的 wanted 為什麼要加 ed 呢? 用want 可以嗎 ?  ,3
22346,72697,just showed   這裡是因為  just所以用過去式嗎 ,3
20340,72697, if you're hired or not 中  hire 為甚麼要加ed   這句是因為被動式嗎?,8
55553,28633,您好，想請問為什麼不使用 today we'll learn ... ，和使用 we'll be learning ... 的差別是？謝謝您,2
6425,28633,Hello 請問以下 but to interpret what we see as efficiently as possible in order to interact with our environment most appropriately. 中的 interpret 和 interact 是否有連音的情形？因為聽起來完全和單字發音時不同，感謝,14
1752,53311,似乎沒聽到what的發音？,14
5175,47283,by the way 為何在影片中翻譯成由於而不是順便一提呢?,14
73137,21670,請問此處為何用whom 而不是who? 謝謝,9
72950,21670,為何此處用given? 而不是用gave? 謝謝,1
69499,21670,as if it were a fiction 請問不是該用was嗎? 謝謝,11
65856,21670,It seems like this is a real moment where people.. 請問為何此處是用where，不是用when? moment不算時間嗎? 謝謝 ,5
65855,21670,請問此處being here插在中間 是什麼文法?  謝謝,5
56508,21670,請問此處where的意思及用法? 謝謝,5
56505,21670,"請問""What did you do at this job?"" but ""Give me an example when you had a crisis. How did you manage it?"" 為何用過去式? 謝謝",3
49462,21670,what it's like 請問此處的LIKE詞性及用法  謝謝,9
48668,21670,and maybe nodding your head as you speak   請問此處as you speak的as是when的意思嗎?  若是的話，為何後面speak不用ing?  謝謝,10
48486,21670,請問此影片的片名? 可在youtube上找到嗎?  因為想存在youtube裡就可以一直聽 謝謝,14
47084,21670,為何此處是說Will Shakespeare was right  而不是is right 這不是一個事實表述嗎?,3
46972,21670,最前面用It's that開頭是什麼意思?  為何這樣用?   謝謝,10
46959,21670,"And then I  come along and I say, ""But guess what, people? Your accent isn't your problem.""  請問為何此處是come along 不是came along?  謝謝",3
46722,21670,請問此處的present是什麼詞? 不懂be presenting 的文法 謝謝,12
22637,78796,請問這句話的原音聽起來..在can和have的中間好像還有另外一個字???,14
20195,78796,"查單字的過程中, 如果判定句中的單字是屬於何種屬性(ex.及物動詞or不及物動詞...等)?",9
1793,53576,And who she became in my head was probably more than the reality. 這句翻成中文，還是看不太懂。 可否解釋一下，謝謝!!,14
10833,55305,"這句話我會誤會成""但是你知道人們(站)在月球上看到的是什麼""  這裡的介係詞""on""的用法麻煩解釋一下。",9
10345,55305,"如果以同樣的句構，中文是""他或許看起來很不穩快要倒下的樣子, but it's not""。英文應該怎麼說。另一個翻譯問題，中文是""他或許看起來很膽小, but it's not""。英文應該怎麼說",14
93131,82365," but rabies can come(which is) wrapped in cute little packages, too.  請問這句是不是有省略which is ",13
49416,82365,請問這裡的over是甚麼意思?,8
47041,82365,"請問shipped to 的發音, shipped結尾的t是要單獨發音還是跟to的t一起念?",14
44479,82365,"請問這裡為什麼是使用thinking, 可以改成to think about him 嗎?",6
41395,82365,請問這裡是省略關係代名詞which lie 變成 lying嗎?,5
30692,82365,請問影片中worked是不是沒有完整念出發音?,14
30521,82365,請問It's critical that you understand the three essential skills to (have) good table manners 這邊為什麼不用加have?,6
30369,82365,請問這邊I've been 和 those have been 為什麼需要使用完成式?,1
